{
  "source_document_id": "PENALTY-SANITIZED-001",
  "doc_id": "doc-001",
  "list_source_ref": {
    "relative_path": "list.xlsx",
    "sheet_name": "bank_punish_detail_list",
    "row_number": 1,
    "file_sha256": "aaaaaaaaaaaaaaaaaaaaaaaaaaaaaaaaaaaaaaaaaaaaaaaaaaaaaaaaaaaaaaaa",
    "row_sha256": "bbbbbbbbbbbbbbbbbbbbbbbbbbbbbbbbbbbbbbbbbbbbbbbbbbbbbbbbbbbbbbbb"
  },
  "text_source_ref": {
    "relative_path": "text.xlsx",
    "sheet_name": "bank_punish_detail_txt",
    "row_number": 1,
    "file_sha256": "cccccccccccccccccccccccccccccccccccccccccccccccccccccccccccccccc",
    "row_sha256": "dddddddddddddddddddddddddddddddddddddddddddddddddddddddddddddddd"
  },
  "join_status": "matched",
  "common_field_conflicts": [],
  "decision_document_number_raw": "某罚决字〔2023〕1号",
  "punished_person_name_raw": "某自然人",
  "punished_org_name_raw": null,
  "legal_representative_name_raw": null,
  "violation_facts_raw": "违规发放贷款",
  "penalty_basis_raw": "《某商业银行监管规定》第X条",
  "penalty_decision_raw": "警告并罚款",
  "decision_authority_raw": "某监管局",
  "decision_date_raw": "2023-06-15",
  "disclosure_recommendation_raw": null,
  "list_document_title_raw": "行政处罚信息公开表",
  "list_publish_date_raw": "2023-06-15",
  "list_document_source_raw": "某监管局",
  "list_source_url": "https://example.gov.cn/list/001",
  "text_document_title_raw": "行政处罚决定书",
  "text_publish_date_raw": "2023-06-15",
  "text_document_source_raw": "某监管局",
  "text_source_url": "https://example.gov.cn/text/001",
  "full_text_raw": "某自然人因违反信贷管理规定被处罚。经查，某自然人在担任某银行信贷部总经理期间，存在违规发放贷款行为。依据《某商业银行监管规定》第X条，处以警告并罚款。",
  "full_text_status": "available",
  "source_spans": [
    {"source_span_id": "span-0001", "char_start": 0, "char_end": 17, "line_start": 1, "line_end": 1, "text": "某自然人因违反信贷管理规定被处罚。"},
    {"source_span_id": "span-0002", "char_start": 17, "char_end": 40, "line_start": 1, "line_end": 1, "text": "经查，某自然人在担任某银行信贷部总经理期间，"},
    {"source_span_id": "span-0003", "char_start": 40, "char_end": 50, "line_start": 1, "line_end": 1, "text": "存在违规发放贷款行为。"},
    {"source_span_id": "span-0004", "char_start": 50, "char_end": 68, "line_start": 1, "line_end": 1, "text": "依据《某商业银行监管规定》第X条，"},
    {"source_span_id": "span-0005", "char_start": 68, "char_end": 76, "line_start": 1, "line_end": 1, "text": "处以警告并罚款。"}
  ],
  "source_snapshot": {
    "files": [
      {"relative_path": "list.xlsx", "sheet_name": "bank_punish_detail_list", "file_sha256": "aaaaaaaaaaaaaaaaaaaaaaaaaaaaaaaaaaaaaaaaaaaaaaaaaaaaaaaaaaaaaaaa", "row_count": 1, "collected_at": "2026-08-13T00:00:00+00:00"},
      {"relative_path": "text.xlsx", "sheet_name": "bank_punish_detail_txt", "file_sha256": "cccccccccccccccccccccccccccccccccccccccccccccccccccccccccccccccc", "row_count": 1, "collected_at": "2026-08-13T00:00:00+00:00"}
    ]
  },
  "source_package_schema_version": "penalty-source-v1"
}
